name,meal_type,servings_original,servings_scaled,scale_factor,scaling_warnings,prep_time,cook_time,total_time,ease,ingredients_original,ingredients_scaled,method,source_url,scraped_date,tags_key_ingredients,tags_cuisine,tags_season,tags_diet
Sri Lankan Style Devilled Paneer with Basmati Rice and Homemade Mango Sambol,main,2,4,2,cinnamon | soy sauce,,,20m,0.7025,150 grams Basmati Rice | 226 grams Paneer | 1 unit(s) Red Onion | 1 unit(s) Mango | 1 unit(s) Lime | 15 grams Ginger Puree | 30 grams Tomato Puree | 1 sachet(s) Ground Cinnamon | 25 milliliter(s) Soy Sauce | 30 grams Hot Sauce | 1 tbsp Oil for Cooking | 1 tsp Sugar for the Pickle | 1 tbsp Tomato Ketchup | 2 tsp Sugar for the Sauce | 75 milliliter(s) Water for the Sauce,300 grams Basmati Rice | 452 grams Paneer | 2unit(s) Red Onion | 2unit(s) Mango | 2unit(s) Lime | 30 grams Ginger Puree | 60 grams Tomato Puree | 2sachet(s) Ground Cinnamon | 50 milliliter(s) Soy Sauce | 60 grams Hot Sauce | 2 tbsp Oil for Cooking | 2 tsp Sugar for the Pickle | 2 tbsp Tomato Ketchup | 4 tsp Sugar for the Sauce | 150 milliliter(s) Water for the Sauce,"a) Boil a half-full kettle. b) Pour the boiled water into a large saucepan with 1/4 tsp salt on high heat. Add the rice and cook for 10-12 mins. c) Once cooked, drain in a sieve and pop back in the pan. Cover with a lid and leave to the side until ready to serve. | a) Meanwhile, cut the paneer into 1cm cubes. b) Chop half the red onion into 2cm chunks and thinly slice the other half. c) Heat the oil (see pantry for amount) in a frying pan on medium-high heat. d) Once hot, add the paneer and onion chunks to the pan. Season with salt and pepper. Fry until golden all over, 5-8 mins. Turn regularly to brown the paneer evenly. | a) Meanwhile, peel the mango. Slice down either side of the stone to make 2 'cheeks'. Cut any remaining flesh from the stone, then cut the mango into 1cm thin slices (discard the stone). b) Cut the lime into wedges. c) In a medium bowl, combine the juice from the lime with the sugar for the pickle (see pantry for amount). d) Toss the sliced red onion through the lime dressing. Season with salt and pepper. Gently stir in the mango and set aside for later. | a) Once the paneer is cooked, stir in the ginger puree, tomato puree and cinnamon. Fry until fragrant, 1 min. b) Mix in the soy sauce, ketchup, sugar and water for the sauce (see pantry for all three amounts). c) Bring to a boil, then reduce the heat and simmer until thickened, 3-4 mins. | a) Stir the hot sauce into the paneer. b) Add a splash of water if it's a little too thick. c) Taste and season with more salt, pepper and sugar if needed. | a) Share the rice between your bowls. b) Top with the devilled paneer and mango sambol in separate sections. Enjoy!",https://www.hellofresh.co.uk/recipes/sri-lankan-style-devilled-paneer-66d7165f946ad7f4e083bbb8,2026-07-16,paneer | basmati rice,Sri Lankan | mango sambol,All,vegetarian
"Creamy Harissa Butter Bean Bowl with Garlic Mash, Greek Style Cheese and Flaked Almonds",main,2,4,2,,,,25m,0.7125,450 grams Potatoes | 2 unit(s) Garlic Clove | 1 unit(s) Red Onion | 1 carton(s) Butter Beans | 120 grams Sliced Mushrooms | 30 grams Tomato Puree | 75 grams Creme Fraiche | 50 grams Harissa Paste | 15 grams Worcester Sauce | 50 grams Greek Style Salad Cheese | 15 grams Toasted Flaked Almonds | 1 tbsp Honey | 100 milliliter(s) Water for the Sauce,900 grams Potatoes | 4unit(s) Garlic Clove | 2unit(s) Red Onion | 2carton(s) Butter Beans | 240 grams Sliced Mushrooms | 60 grams Tomato Puree | 150 grams Creme Fraiche | 100 grams Harissa Paste | 30 grams Worcester Sauce | 100 grams Greek Style Salad Cheese | 30 grams Toasted Flaked Almonds | 2 tbsp Honey | 200 milliliter(s) Water for the Sauce,"a) Boil a full kettle. b) While it boils, chop the potatoes into 2cm chunks (no need to peel). Peel the garlic cloves. c) Pour the boiled water into a large saucepan with 1/2 tsp salt for the potatoes. | a) Add the potatoes and garlic to your pan of boiling water. b) Cook until tender, 15-18 mins. | a) Meanwhile, halve, peel and thinly slice the red onion. b) Drain and rinse the butter beans in a sieve. c) Heat a drizzle of oil in a large frying pan on medium-high heat. d) Once hot, add the sliced mushrooms and onion. Season with salt and pepper and fry, stirring occasionally, until browned, 8-10 mins. | a) Add the tomato puree to the pan and cook, stirring, 1 min. b) Stir in the creme fraiche, harissa paste (add less if you'd prefer things milder), Worcester sauce, butter beans, honey and water for the sauce (see pantry for both amounts). Season with salt and pepper. c) Bring to the boil and simmer until reduced, 3-4 mins. | a) Once the potatoes are cooked, drain in a colander and return to the pan, off the heat. b) Add a knob of butter and a splash of milk (if you have any) and mash until smooth. Season with salt and pepper. | a) Share the mash between your plates. b) Top with the harissa butter beans. c) Crumble over the Greek style salad cheese and scatter with the flaked almonds to finish. Enjoy!",https://www.hellofresh.co.uk/recipes/creamy-harissa-butter-bean-bowl-66cd8cf1cb03862f83506f88,2026-07-16,bean | cheese,North African | bowl,Autumn | Winter,vegetarian
Quick Thai Inspired Lentil Curry with Roasted Sweet Potato and Zesty Rice,main,2,4,2,chilli | soy sauce,,,20m,0.7525,2 unit(s) Sweet Potato | 150 grams Jasmine Rice | 1 unit(s) Lime | 2 unit(s) Garlic Clove | 1 carton(s) Lentils | 50 grams Red Thai Style Paste | 1 sachet(s) Thai Style Spice Mix | 180 milliliter(s) Coconut Milk | 15 milliliter(s) Soy Sauce | 30 grams Peanut Butter | 32 grams Sweet Chilli Sauce,4unit(s) Sweet Potato | 300 grams Jasmine Rice | 2unit(s) Lime | 4unit(s) Garlic Clove | 2carton(s) Lentils | 100 grams Red Thai Style Paste | 2sachet(s) Thai Style Spice Mix | 360 milliliter(s) Coconut Milk | 30 milliliter(s) Soy Sauce | 60 grams Peanut Butter | 64 grams Sweet Chilli Sauce,"a) Preheat your oven to 240°C/220°C fan/gas mark 9. Boil a half-full kettle. b) Chop the sweet potatoes into 1cm chunks (no need to peel). c) Put the sweet potato chunks onto a large baking tray. Drizzle with oil, season with salt and pepper, then toss to coat. Spread out in a single layer. TIP: Use two baking trays if necessary. When the oven is hot, roast on the top shelf until golden, 16-18 mins. Turn halfway through. | a) Meanwhile, pour the boiled water into a medium saucepan with 1/4 tsp salt on high heat. Add the rice and cook for 12-13 mins. b) Drain in a sieve and pop back in the pan. Cover with a lid and leave to the side until ready to serve. | a) Meanwhile, zest and cut the lime into wedges. b) Peel and grate the garlic (or use a garlic press). c) Drain and rinse the lentils in a sieve. | a) Heat a drizzle of oil in a large saucepan on medium-high heat. b) Once hot, add the red Thai style paste, Thai style spice blend (add less if you'd prefer things milder) and garlic. Stir-fry until fragrant, 1-2 mins. c) Add the coconut milk, soy, peanut butter and lentils to the pan. Stir well until combined. d) Bring to the boil and simmer until thickened, 6-8 mins. TIP: If your peanut butter has hardened, pop it in a bowl of hot water for 1 min. | a) Once ready, stir the roasted sweet potato, sweet chilli sauce and a squeeze of lime juice into the lentils . Remove from the heat. b) Taste and with salt and pepper if needed. Add a splash of water if it's a little thick. | a) When everything's ready, fluff up the rice with a fork and stir through the lime zest. b) Share the zesty rice between your bowls. Top with the lentil curry. c) Serve any remaining lime wedges alongside for squeezing over. Enjoy!",https://www.hellofresh.co.uk/recipes/quick-thai-inspired-lentil-curry-66cd8cf96041110ff0a4be4b,2026-07-16,lentil | rice,Thai | curry,Autumn | Winter,vegetarian
Curried Cauliflower Cheese Filo Pie with Baby Leaf Salad,main,2,4,2,,,,45m,0.585,3.5 unit(s) Filo Pastry Sheets | 1 unit(s) Cauliflower | 2 unit(s) Garlic Clove | 60 grams Mature Cheddar Cheese | 1 sachet(s) Curry Powder Mix | 10 grams Vegetable Stock Paste | 150 grams Creme Fraiche | 20 grams Baby Leaf Mix | 20 grams Butter | 1.5 tbsp Plain Flour | 175 milliliter(s) Water for the Sauce | 1 tbsp Honey,7unit(s) Filo Pastry Sheets | 2unit(s) Cauliflower | 4unit(s) Garlic Clove | 120 grams Mature Cheddar Cheese | 2sachet(s) Curry Powder Mix | 20 grams Vegetable Stock Paste | 300 grams Creme Fraiche | 40 grams Baby Leaf Mix | 40 grams Butter | 3 tbsp Plain Flour | 350 milliliter(s) Water for the Sauce | 2 tbsp Honey,"Preheat your oven to 200°C/180°C fan/gas mark 6. Remove the filo pastry from the fridge and its packet to bring it to room temperature (see ingredients for amount). Lay it flat on the counter, covered with a damp tea towel. Cut the cauliflower into florets (like small trees), halving any large ones. Pop the cauliflower onto a baking tray. Drizzle with oil, season with salt and pepper, then toss to coat. Spread them out in a single layer. When the oven is hot, roast on the top shelf until golden brown and tender, 15-20 mins. Turn halfway through. | Meanwhile, peel and grate the garlic (or use a garlic press). Grate the Cheddar cheese. Melt the butter (see pantry for amount) in a large saucepan on medium-high heat. Once hot, stir in the garlic and curry powder. Fry until fragrant, 1 min. Stir in the flour (see pantry for amount). Cook until it forms a paste, 1-2 mins - you've made a roux! | Stir the water for the sauce (see pantry for amount) into the roux a little at a time, followed by the vegetable stock paste. Bring to the boil, stir continuously and simmer until thickened, 1-2 mins. Mix in the creme fraiche and cheese until melted, then remove from the heat. Once roasted, stir the cooked cauliflower into the sauce. Add a splash of water if it's a little too thick. Season with salt and pepper. | Meanwhile, halve the filo pastry sheets to make squares. Spoon the cheesy cauliflower mixture into an appropriate sized ovenproof dish. Scrunch each filo pastry sheet into a very loose ball and place on top of the pie. Repeat until the whole pie is covered, making sure not to overcrowd the pastry (discard any excess pastry). | Drizzle the whole pie with oil, then bake on the top shelf of your oven until the filo is golden, 10-15 mins. | Share the curried cauliflower cheese pie between your plates. Drizzle the honey (see pantry for amount) over the pie to finish. Serve the baby leaves alongside with a drizzle of olive oil over the leaves. Enjoy!",https://www.hellofresh.co.uk/recipes/curried-cauliflower-cheese-filo-pie-66cd8cef92634d59399b4237,2026-07-16,cauliflower | cheese,British | bake,Autumn | Winter,vegetarian
"Veggie Red Thai Style Noodle Soup with Soy Mushrooms, Baby Corn and Green Beans",main,2,4,2,egg | soy sauce,,,30m,0.6775,60 grams Baby Corn | 80 grams Green Beans | 2 unit(s) Portobello Mushrooms | 15 milliliter(s) Soy Sauce | 50 grams Red Thai Style Paste | 1 sachet(s) Thai Style Spice Mix | 1 sachet(s) Ground Turmeric | 180 milliliter(s) Coconut Milk | 10 grams Vegetable Stock Paste | 125 grams Egg Noodle Nest | 1 tbsp Honey | 1 tsp Sugar | 500 milliliter(s) Water for the Soup,120 grams Baby Corn | 160 grams Green Beans | 4unit(s) Portobello Mushrooms | 30 milliliter(s) Soy Sauce | 100 grams Red Thai Style Paste | 2sachet(s) Thai Style Spice Mix | 2sachet(s) Ground Turmeric | 360 milliliter(s) Coconut Milk | 20 grams Vegetable Stock Paste | 250 grams Egg Noodle Nest | 2 tbsp Honey | 2 tsp Sugar | 1000 milliliter(s) Water for the Soup,"Halve the baby corn lengthways. Trim the green beans, then cut into thirds. Remove the stems from the portobello mushrooms (but leave the mushrooms whole). | Heat a drizzle of oil in a large frying pan on high heat. Once hot, fry the mushrooms until golden brown, 4-5 mins, then turn over and cook for a further 4-5 mins. Pour over the soy sauce and fry for 1 min more until the mushrooms have soaked up some of the soy sauce. Transfer them, stem-side up, to a lined baking tray. Drizzle over the honey (see pantry for amount). Bake on the top shelf of your oven until softened, 8-10 mins. | Meanwhile, heat a drizzle of oil in a large saucepan on medium heat. Add the red Thai style paste, Thai style spice blend (add less if you'd prefer things milder) and turmeric. Fry until fragrant, stirring occasionally, 2 mins. | Add the coconut milk, vegetable stock paste, sugar and the water for the soup (see pantry for both amounts). Stir to combine. Bring to the boil, then add the baby corn and green beans. Simmer for 1-2 mins. Season with salt and pepper. | Once the soup has simmered, add the noodles and cook until tender, 4 mins. Season with salt and pepper. Add a splash of water to loosen if needed. When the mushrooms are cooked, carefully drain off any excess liquid, then slice widthways into 1cm slices. | Share the Thai style noodle soup between your bowls and top with the soy mushrooms. Enjoy!",https://www.hellofresh.co.uk/recipes/veggie-red-thai-style-noodle-soup-66cd8d076041110ff0a4be5a,2026-07-16,egg noodle nest | portobello mushrooms,Thai | noodle soup,Autumn | Winter,vegetarian
Glazed Halloumi Loaded Patatas Bravas with Garlic Aioli and Rocket,main,2,4,2,chilli | paprika,,,35m,0.6425,700 grams Potatoes | 1 unit(s) Red Onion | 1 sachet(s) Dried Oregano | 4 unit(s) Garlic Clove | 225 grams Halloumi | 1 sachet(s) Smoked Paprika | 1 carton(s) Tomato Passata | 28 grams Red Wine Stock Paste | 25 grams Red Pepper Chilli Jelly | 96 grams Mayonnaise | 20 grams Wild Rocket | 1 tsp Sugar | 50 milliliter(s) Water for the Sauce,1400 grams Potatoes | 2unit(s) Red Onion | 2sachet(s) Dried Oregano | 8unit(s) Garlic Clove | 450 grams Halloumi | 2sachet(s) Smoked Paprika | 2carton(s) Tomato Passata | 56 grams Red Wine Stock Paste | 50 grams Red Pepper Chilli Jelly | 192 grams Mayonnaise | 40 grams Wild Rocket | 2 tsp Sugar | 100 milliliter(s) Water for the Sauce,"Preheat your oven to 220°C/200°C fan/gas mark 7. Chop the potatoes into 2cm chunks (no need to peel). Halve and peel the red onion, then cut each half into 3 wedges. Pop the potato and onion onto a large baking tray. Drizzle with oil, season with salt and pepper, sprinkle over the dried oregano, then toss to coat. Spread out in a single layer. TIP: Use two baking trays if necessary. When the oven is hot, roast on the top shelf until golden, 25-35 mins. Turn halfway through. | In the meantime, pop half the garlic (unpeeled) into a small piece of foil with a drizzle of oil and scrunch to enclose it. Roast the parcel until soft, 10-12 mins. Meanwhile, drain the halloumi, then cut it into 3 slices per person. Place them into a small bowl of cold water and leave to soak. | Meanwhile, peel and grate the remaining garlic (or use a garlic press) Heat a drizzle of oil in a medium saucepan. Once hot, add the grated garlic and smoked paprika. Fry for 1 min. Stir through the passata, red wine stock paste, sugar and water for the sauce (see pantry for both amounts). Bring up to the boil, then lower to a simmer and cook until thickened, 4-5 mins. | Remove the halloumi slices from the cold water, pop them onto a plate lined with kitchen paper and pat them dry. Heat a drizzle of oil in a frying pan on medium-high heat. Once hot, add the halloumi and fry until golden, 2-3 mins each side. | Once the halloumi is cooked, remove from the heat and drizzle over the red pepper chilli jelly. Turn the halloumi in the glaze until well coated. Once the garlic has cooled, cut the end with scissors, squeeze it out of the skin and mash with a fork. Mix together in a small bowl with the mayonnaise and season with salt and pepper. Set your aioli aside. | Share your roasted veg between your serving bowls and pour the bravas sauce all over. Drizzle over your garlic aioli. Arrange your glazed halloumi on top and serve with a handful of rocket to finish. Enjoy!",https://www.hellofresh.co.uk/recipes/glazed-halloumi-loaded-patatas-bravas-66cd8cee6041110ff0a4be44,2026-07-16,potato | halloumi,Spanish | stew,Autumn | Winter,vegetarian
Smoky Roasted Butternut Squash Filo Pie with Garlicky Green Beans and Flaked Almonds,main,2,4,2,,,,45m,0.585,3.5 unit(s) Filo Pastry Sheets | 1 unit(s) Butternut Squash | 1 sachet(s) Chermoula Spice Mix | 3 unit(s) Garlic Clove | 150 grams Green Beans | 30 grams Tomato Puree | 75 grams Creme Fraiche | 40 grams Baby Spinach | 1 sachet(s) Smoky Base Paste | 15 grams Toasted Flaked Almonds | 1 tsp Sugar | 200 milliliter(s) Water for the Sauce,7unit(s) Filo Pastry Sheets | 2unit(s) Butternut Squash | 2sachet(s) Chermoula Spice Mix | 6unit(s) Garlic Clove | 300 grams Green Beans | 60 grams Tomato Puree | 150 grams Creme Fraiche | 80 grams Baby Spinach | 2sachet(s) Smoky Base Paste | 30 grams Toasted Flaked Almonds | 2 tsp Sugar | 400 milliliter(s) Water for the Sauce,"Preheat your oven to 240°C/220°C fan/gas mark 9. Remove the filo pastry from the fridge to bring it to room temperature. Trim the butternut squash, halve lengthways, then scoop out the seeds (peel first if you prefer). Cut into 2cm chunks. | Pop the butternut chunks onto a large baking tray. Drizzle with oil, sprinkle over the chermoula spice mix, season with salt and pepper, then toss to coat. Spread out in a single layer. TIP: Use two baking trays if necessary. When the oven is hot, roast on the top shelf until golden and cooked through, 18-20 mins. Turn halfway through. Meanwhile, peel and grate the garlic (or use a garlic press). Trim the green beans. | When the squash has 5 mins remaining, heat a drizzle of oil in a large frying pan on medium-high heat. Once hot, add the tomato puree and half the garlic. Cook until fragrant, 1 min. Stir in the creme fraiche, sugar and water for the sauce (see pantry for both amounts). Bring the boil and simmer until thickened slightly, 2-3 mins. | Add the spinach to the pan a handful at a time until wilted and piping hot, 1-2 mins. Stir through the roasted squash and smoky base paste, then remove from the heat. Transfer to an appropriately sized ovenproof dish. Lower your oven temperature to 200°C/180°C fan/gas mark 6. Halve the filo pastry sheets (see ingredients for amount) to make squares. Scrunch each filo pastry sheet into a very loose ball and place on top of the mixture. Repeat until the whole pie is covered, making sure not to overcrowd the pastry (discard any excess pastry). Drizzle the pie with oil, then bake on the top shelf of your oven until the golden, 10-15 mins. | Meanwhile, wipe out the (now empty) frying pan and return to medium-high heat with a drizzle of oil. Once hot, add the green beans and stir-fry until starting to char, 2-3 mins. Stir in the remaining garlic, then turn the heat down to medium and cook for 1 min. Add a splash of water and immediately cover with a lid or some foil. Cook until tender, 4-5 mins. Remove from the heat. | Share the filo pie between your plates. Serve the green beans alongside. Sprinkle over the flaked almonds to finish. Enjoy!",https://www.hellofresh.co.uk/recipes/smoky-roasted-butternut-squash-filo-pie-66e99b8a00a3edabf7afa266,2026-07-16,butternut squash | filo pastry,Middle Eastern | pie,Autumn | Winter,vegetarian
Oven-Baked Veggie 'Nduja and Burrata Risotto with Peas and Hard Italian Style Cheese,main,2,4,2,,,,45m,0.585,1 unit(s) Onion | 2 unit(s) Garlic Clove | 175 grams Risotto Rice | 20 grams Vegetable Stock Paste | 1 unit(s) Lemon | 120 grams Peas | 1 sachet(s) Vegan ‘Nduja | 20 grams Grated Hard Italian Style Cheese | 125 grams Burrata | 20 grams Butter | 1 tsp Sugar | 600 milliliter(s) Boiled Water for the Risotto,2unit(s) Onion | 4unit(s) Garlic Clove | 350 grams Risotto Rice | 40 grams Vegetable Stock Paste | 2unit(s) Lemon | 240 grams Peas | 2sachet(s) Vegan ‘Nduja | 40 grams Grated Hard Italian Style Cheese | 250 grams Burrata | 40 grams Butter | 2 tsp Sugar | 1200 milliliter(s) Boiled Water for the Risotto,"Preheat your oven to 220°C/200°C fan/gas mark 7. Boil a full kettle. Halve, peel and thinly slice the onion. Peel and grate the garlic (or use a garlic press). | Melt the butter (see pantry for amount) in a large, wide-bottomed ovenproof pan on medium heat. TIP: If you don't have an ovenproof pan, use a normal pan and transfer to an ovenproof dish before baking. Once melted, add the onion, season with salt and pepper and fry, stirring occasionally, until softened, 8-10 mins. | Add the garlic and sugar (see pantry for amount) to the onion. Cook until caramelised, 1-2 mins more. Add the risotto rice, stir and cook until the edges of the rice are translucent, 1-2 mins. | Stir in the boiled water for the risotto (see pantry for amount) and veg stock paste. Bring back up to the boil, then pop a lid on the pan (or cover with foil). Bake on the middle shelf of your oven until the rice is cooked and the water has been absorbed, 25-30 mins. Meanwhile, zest and halve the lemon. | When the risotto is cooked, remove it from the oven and stir through the peas, vegan 'Nduja (add less if you'd prefer things milder) and hard Italian style cheese until well combined. Squeeze in the juice from half the lemon. Taste and season with salt, pepper and more lemon juice if needed. TIP: Add a splash of water to loosen the risotto if needed. | Share the risotto between your bowls. Tear the burrata in half and place on top. Sprinkle over the lemon zest. Finish with a crack of black pepper. Enjoy!",https://www.hellofresh.co.uk/recipes/oven-baked-veggie-nduja-and-burrata-risotto-66e99b8907f7f5443341e319,2026-07-16,risotto rice | burrata | peas | hard italian style cheese,Italian | risotto,Autumn | Winter,vegetarian
"Cheesy Mediterranean Style Chickpea Pie with Aubergine, Pepper and Herby Carrots",main,2,4,2,,,,45m,0.56,½ pack(s) Puff Pastry Sheet | 1 unit(s) Bell Pepper | 1 unit(s) Aubergine | 3 unit(s) Carrot | 1 sachet(s) Mixed Herbs | 3 unit(s) Garlic Clove | 1 carton(s) Chickpeas | 1 carton(s) Tomato Passata | 10 grams Vegetable Stock Paste | 50 grams Harissa Paste | 20 grams Grated Hard Italian Style Cheese | 1 tsp Sugar | 100 milliliter(s) Water for the Sauce | 1 tbsp Honey,1pack(s) Puff Pastry Sheet | 2unit(s) Bell Pepper | 2unit(s) Aubergine | 6unit(s) Carrot | 2sachet(s) Mixed Herbs | 6unit(s) Garlic Clove | 2carton(s) Chickpeas | 2carton(s) Tomato Passata | 20 grams Vegetable Stock Paste | 100 grams Harissa Paste | 40 grams Grated Hard Italian Style Cheese | 2 tsp Sugar | 200 milliliter(s) Water for the Sauce | 2 tbsp Honey,"Preheat your oven to 220°C/200°C fan/gas mark 7. Remove the puff pastry from your fridge to allow it to come to room temperature. Halve the bell pepper and discard the core and seeds. Chop into 2-3cm chunks. Trim the aubergine, then cut into roughly 2cm pieces. Pop the pepper and aubergine onto a baking tray. Drizzle with oil, season with salt and pepper, then toss to coat. Spread out in a single layer. When the oven is hot, roast the veg on the top shelf until soft and golden, 25-30 mins. Turn halfway through. | Meanwhile, trim the carrots, then halve lengthways (no need to peel). Chop into roughly 1cm wide, 5cm long batons. Pop the carrots onto a large baking tray. Sprinkle over the mixed herbs. Drizzle with oil, season with salt and pepper, then toss to coat. Spread out in a single layer. Set aside. Peel and grate the garlic (or use a garlic press). Drain and rinse the chickpeas in a sieve. | Heat a drizzle of oil in a large frying pan on medium-high heat. Once hot, add the garlic and stir-fry for 30 secs. Stir in the chickpeas, passata, vegetable stock paste, harissa paste (add less if you'd prefer things milder), sugar and water for the sauce (see pantry for both amounts). Bring to the boil, then simmer until the sauce has thickened slightly, 3-4 mins. | Once the aubergine and pepper have cooked, stir them into the sauce in the frying pan. Stir in the hard Italian style cheese. Roast the carrots on the middle shelf until tender, 20-25 mins. Turn halfway through. | Transfer your vegetable filling to an appropriately sized ovenproof dish. Cover the dish with the pastry (see ingredients for amount), pressing it over the side of the dish or just sitting it on top, then trimming off any excess. Make a small hole in the middle to allow steam to escape. TIP: Brush the pastry with a little milk if you have some. Bake your pie on the top shelf of your oven until golden brown, 15-20 mins. Once it's out of the oven, allow it to stand for 2 mins. | When the carrots have 5 mins remaining, remove the tray from the oven. Drizzle over the honey (see pantry for amount) and toss to coat. Return to the oven for the remaining time. Once the carrots are roasted, share the cheesy veg pie between your plates. Serve with the roasted carrots on the side. Enjoy!",https://www.hellofresh.co.uk/recipes/cheesy-mediterranean-style-chickpea-pie-66e066eba3dfaa8a349aa6cb,2026-07-16,chickpea | cheese,Mediterranean | pie,Autumn | Winter,vegetarian
