name,meal_type,servings_original,servings_scaled,scale_factor,scaling_warnings,prep_time,cook_time,total_time,ease,ingredients_original,ingredients_scaled,method,source_url,scraped_date,tags_key_ingredients,tags_cuisine,tags_season,tags_diet
Smoky tofu tacos,main,Serves 3–4,4,1.33,chilli | paprika | cloves | soy sauce | salt,30m,30m,,0.5494,"450g/14oz extra-firm tofu | 4 tbsp olive oil | 2 banana shallots, thinly sliced | 1 small sweet potato, peeled and diced into 1cm/½in cubes | 2 garlic cloves, finely chopped | 2 tsp dried oregano | 1 tbsp chipotle paste | 1 tbsp sweet smoked paprika | ½ tsp chilli powder | ½ tsp ground cumin | 2 tbsp light soy sauce | 1 tbsp balsamic vinegar | 2 tbsp maple syrup | 1 tbsp tomato purée | 2 large avocadoes | 3 limes | handful coriander, roughly chopped | salt and freshly ground black pepper | 10–12 small flour tortillas | soured cream (optional) | spring onion, finely sliced (optional) | red chilli, finely sliced (optional)","600g/18.67 oz extra-firm tofu | 5.33 tbsp olive oil | 2.67banana shallots, thinly sliced | 1.33small sweet potato, peeled and diced into 1.33cm/0.67in cubes | 2.67garlic cloves, finely chopped | 2.67 tsp dried oregano | 1.33 tbsp chipotle paste | 1.33 tbsp sweet smoked paprika | 0.67 tsp chilli powder | 0.67 tsp ground cumin | 2.67 tbsp light soy sauce | 1.33 tbsp balsamic vinegar | 2.67 tbsp maple syrup | 1.33 tbsp tomato purée | 2.67large avocadoes | 4limes | handful coriander, roughly chopped | salt and freshly ground black pepper | 13.33–16small flour tortillas | soured cream (optional) | spring onion, finely sliced (optional) | red chilli, finely sliced (optional)","Drain the tofu and place on a plate between a few sheets of kitchen paper. Place a saucepan or stack of plates on top to squeeze out as much water as possible without crushing the tofu. | While the tofu drains, heat 2 tablespoons of the oil in a large frying pan over a medium-high heat and fry the shallots and sweet potato for 5 minutes or so, until the shallots are softened and the sweet potato is starting to colour. Add the garlic and oregano and continue to cook for a further 10–15 minutes, or until the sweet potato is cooked through. | In a large bowl combine the chipotle paste, paprika, chilli powder, cumin, soy sauce, balsamic vinegar, maple syrup, tomato purée and 1 tablespoon of the olive oil. | Once the tofu has drained for 5–10 minutes, crumble it into rough 1–2 cm/½–¾ in pieces into the large bowl with the flavourings and spices. Season to taste with salt and pepper and mix to coat well. | Transfer the sweet potato and shallots to a plate and wipe out the pan with kitchen paper. Add the remaining oil to the same pan and fry the tofu in a single layer. Don’t move the pan and leave to cook for 5 minutes over a medium heat. The tofu should start to sizzle and pop. Using a flat spatula or similar, carefully flip the tofu in sections to cook the other side for another 5 minutes. | While the tofu cooks, peel the avocado and remove the stone. Using the back of a fork, mash the avocado in a bowl with the juice of 2 of the limes, half of the fresh coriander and some salt and pepper. | Once the tofu is cooked, add the sweet potato mixture back to the pan, stir to combine and take off the heat. | To serve, warm the tortillas up in a microwave or, one at a time, in a dry frying pan. Cover with a clean tea towel to keep them warm while you repeat with the remaining tortillas. | Add a little guacamole to the base of each tortilla, top with the smoky tofu filling and finish with a drizzle of soured cream and spring onions and chilli, if using. Serve with the remaining coriander and wedges of lime.",https://www.bbc.co.uk/food/recipes/smoky_tofu_tacos_35909,2026-07-14,tofu | sweet potato,Mexican | tacos,Autumn | Winter,vegetarian
Spiced aloo gobi traybake,main,Serves 4,4,1,,30m,1h,,0.6447,"600g/1lb 5oz floury potatoes, cut into 15mm/⅝in cubes | 1 large cauliflower, cut into large florets | 1 red onion, roughly chopped | 4 garlic cloves, grated | 5cm/2in piece fresh root ginger, grated | 1 small piece fresh turmeric, grated, or ½ tsp ground turmeric | 1 red chilli, cut in half lengthwise | 2 tsp ground cumin | 2 tsp ground coriander | 2 tsp nigella seeds | 3 tbsp oil | 1 tsp sea salt flakes | 400g/14oz cherry tomatoes on the vine, halved | 200ml/7fl oz boiling water | 1 lime, juice only | handful fresh coriander, roughly chopped | rice or naan breads, to serve","600g/1lb 5oz floury potatoes, cut into 15mm/⅝in cubes | 1 large cauliflower, cut into large florets | 1 red onion, roughly chopped | 4 garlic cloves, grated | 5cm/2in piece fresh root ginger, grated | 1 small piece fresh turmeric, grated, or ½ tsp ground turmeric | 1 red chilli, cut in half lengthwise | 2 tsp ground cumin | 2 tsp ground coriander | 2 tsp nigella seeds | 3 tbsp oil | 1 tsp sea salt flakes | 400g/14oz cherry tomatoes on the vine, halved | 200ml/7fl oz boiling water | 1 lime, juice only | handful fresh coriander, roughly chopped | rice or naan breads, to serve","Preheat the oven to 220C/200C Fan/Gas 7. Tip the potatoes, cauliflower, onion, garlic, ginger, turmeric, chilli, spices, oil and salt into a large roasting tin, and mix well. (If everything doesn’t fit comfortably in one layer, transfer half of the mixture into a second roasting tin.) Transfer the tin/s to the oven to roast for 40 minutes. | After 40 minutes, add the cherry tomatoes and boiling water (evenly between the two if you are using two tins), then return to the oven for a further 20 minutes, reducing the heat to 200C/180C Fan/Gas 6. | Taste and adjust the salt as needed, squeeze over the lime juice, and scatter with the fresh coriander before serving with hot rice or naan breads.",https://www.bbc.co.uk/food/recipes/spiced_aloo_gobi_54698,2026-07-14,potato | cauliflower,Indian | bake,Autumn | Winter,vegetarian
Easy halloumi burgers,main,Serves 2,4,2,salt,30m,10m,,0.71,"2 tbsp olive oil | 2 portobello mushrooms, wiped clean and stalks removed | 200g/7oz halloumi cheese, thickly sliced | 2 brioche buns, cut in half | 2 tbsp finely chopped onion | 2 tbsp finely chopped tomato | 2 tbsp finely chopped cucumber | 2 tbsp finely chopped fresh mint | 1 lime, juice only | 4 tbsp hummus | 1 large tomato, thickly sliced | 4 romaine lettuce leaves, roughly torn | salt and freshly ground black pepper","4 tbsp olive oil | 4portobello mushrooms, wiped clean and stalks removed | 400g/14 oz halloumi cheese, thickly sliced | 4brioche buns, cut in half | 4 tbsp finely chopped onion | 4 tbsp finely chopped tomato | 4 tbsp finely chopped cucumber | 4 tbsp finely chopped fresh mint | 2lime, juice only | 8 tbsp hummus | 2large tomato, thickly sliced | 8romaine lettuce leaves, roughly torn | salt and freshly ground black pepper","Heat a griddle pan or barbecue until hot. Brush half the oil over the mushrooms and season well. Place on the griddle pan or barbecue and cook for 6–8 minutes, turning them over halfway through cooking. | Meanwhile, brush the remaining oil over the halloumi slices and cut-side of the brioche buns. Cook for 2–3 minutes, or until lightly charred. | Mix together the chopped onion, tomato, cucumber and mint with the lime juice and season well. | To assemble the burgers, put a mushroom on the bottom brioche half and spread over the hummus. Top with the sliced tomato, lettuce and halloumi. Spoon over the onion and tomato relish, sandwich with the brioche lid and eat straight away.",https://www.bbc.co.uk/food/recipes/chargrilled_halloumi_09010,2026-07-14,halloumi | mushroom,Mediterranean | burger,Summer | Autumn,vegetarian
Vegetarian moussaka,main,Serves 4–6,4,1,,30m,1h,,0.4892,"160g/5½oz red lentils | 650g/1lb 7oz floury potatoes, scrubbed | 1 tsp olive oil | 2 onions, finely chopped | 2 garlic cloves, finely chopped | 4 sprigs thyme, leaves picked | ½ tsp dried oregano | ½ tsp ground cinnamon | 1 tbsp tomato purée | 400g tin chopped tomatoes | 1 vegetable stock cube (use gluten-free stock if needed) | ½ tsp sea salt | 2 tbsp roughly chopped flat leaf parsley | 2 large aubergines, thinly sliced | 250g/9oz ricotta | 50g/1¾oz mature cheddar, grated | freshly ground black pepper","160g/5½oz red lentils | 650g/1lb 7oz floury potatoes, scrubbed | 1 tsp olive oil | 2 onions, finely chopped | 2 garlic cloves, finely chopped | 4 sprigs thyme, leaves picked | ½ tsp dried oregano | ½ tsp ground cinnamon | 1 tbsp tomato purée | 400g tin chopped tomatoes | 1 vegetable stock cube (use gluten-free stock if needed) | ½ tsp sea salt | 2 tbsp roughly chopped flat leaf parsley | 2 large aubergines, thinly sliced | 250g/9oz ricotta | 50g/1¾oz mature cheddar, grated | freshly ground black pepper","Preheat the oven to 200C/180C Fan/Gas 6. | Put the lentils in a bowl and cover with cold water. Set aside to soak. | Put the potatoes in a saucepan, cover with water and bring to the boil. Turn the heat down and simmer for 15–18 minutes until just tender. | Heat the oil in a large frying pan or sauté pan. Add the onions and cook over a medium heat for 5–6 minutes until just softening. | Add the garlic, thyme, oregano and cinnamon and cook for 1 minute, stir in the tomato purée and cook for a further minute. | Add the tomatoes, salt and pepper and bring to a simmer. Fill the tomato tin with water and add to the pan. Do this once more and add the stock cube (this should be 800ml/1pint 8fl oz water in total). | Drain the lentils and stir into the tomato sauce. Bring to the boil and simmer over a medium heat, stirring occasionally, for 20 minutes until the lentils are soft and most of the liquid has been absorbed. Stir in the parsley. | Meanwhile, drain the potatoes and run under cold water until cool enough to hold. Using a spoon, scrape the skin off of the potatoes, then cut into slices about 7mm/⅜in thick and set aside. | Heat a griddle pan until hot. Griddle the aubergine in batches until browned and softened (alternatively, rub the aubergines slices in a little oil to prevent them sticking and use a frying pan). | Spoon half the lentil sauce into a medium ovenproof dish then layer half the potatoes and aubergines over the top. Top with the remaining lentils, potatoes and aubergines. | Put the ricotta into a small bowl and stir in the grated cheese. Spoon the mixture over the aubergines and spread to cover the top. | Bake in the oven for 20–25 minutes, or until heated through and golden brown. | Serve warm with a green salad.",https://www.bbc.co.uk/food/recipes/red_lentil_and_aubergine_33187,2026-07-14,lentil | potato,Greek | bake,Autumn | Winter,vegetarian
Saag aloo chicken jalfrezi,main,Serves 4,4,1,,30m,30m,,0.6767,"vegetable oil, for frying | 3 dried red chillies | 4 garlic cloves, thinly sliced | 400g tin cream of tomato soup | 1½ tsp salt | 4 tbsp brown sauce | 4 tbsp art masala mix (see <a href=""https://www.bbc.co.uk/food/recipes/art_masala_eight-spice_81290"">recipe here</a>) | 2 red onions, quartered | 2 red peppers, cut into large chunks | 560g tin potatoes, drained and halved | 200g/7oz cooked chicken | 80g/3oz fresh baby spinach | handful fresh coriander | 2 spring onions, thinly sliced","vegetable oil, for frying | 3 dried red chillies | 4 garlic cloves, thinly sliced | 400g tin cream of tomato soup | 1½ tsp salt | 4 tbsp brown sauce | 4 tbsp art masala mix (see <a href=""https://www.bbc.co.uk/food/recipes/art_masala_eight-spice_81290"">recipe here</a>) | 2 red onions, quartered | 2 red peppers, cut into large chunks | 560g tin potatoes, drained and halved | 200g/7oz cooked chicken | 80g/3oz fresh baby spinach | handful fresh coriander | 2 spring onions, thinly sliced","Put a large non-stick frying pan or wok over a high heat and drizzle with a few tablespoons of oil. | Once hot, add the dried red chillies and fry until they swell up. Lower the heat and add the garlic. Fry until the garlic is a deep golden-brown. | Add the cream of tomato soup, salt, brown sauce and art masala spice mix. Cook until the volume of liquid is reduced by half and you have a thick sauce. | Add the red onion, red pepper, tinned potatoes and cooked chicken. Cook over a medium heat until the onions are tender. Increase the heat to high and stir until everything is evenly coated, the chicken is pipping hot and the sauce begins to catch on the base of the pan. | Take off the heat and stir in the spinach until just wilted. Serve the curry immediately with the coriander and spring onion sprinkled over.",https://www.bbc.co.uk/food/recipes/saag_aloo_chicken_56514,2026-07-14,chicken | potato,Indian | curry,Autumn | Winter,meat
Chorizo gnocchi,main,Serves 4,4,1,,30m,1h,,0.6711,"120g/4¼oz chorizo, diced (buy a ring or pre-diced) | 1 onion, finely chopped | 1 tbsp olive oil | 2 red, orange or yellow peppers, seeds removed and cut into 2cm/¾in chunks | 4 garlic cloves, crushed or finely chopped | 2 x 400g tins chopped tomatoes | 2 tbsp tomato purée | 2 tsp sugar | 500g/1lb 2oz gnocchi | 100–125g/3½–4½oz kale, leaves roughly chopped and thick stalks discarded (or use a 100g bag of spinach) | 125g/4½oz ball mozzarella, torn or sliced | salt and freshly ground black pepper","120g/4¼oz chorizo, diced (buy a ring or pre-diced) | 1 onion, finely chopped | 1 tbsp olive oil | 2 red, orange or yellow peppers, seeds removed and cut into 2cm/¾in chunks | 4 garlic cloves, crushed or finely chopped | 2 x 400g tins chopped tomatoes | 2 tbsp tomato purée | 2 tsp sugar | 500g/1lb 2oz gnocchi | 100–125g/3½–4½oz kale, leaves roughly chopped and thick stalks discarded (or use a 100g bag of spinach) | 125g/4½oz ball mozzarella, torn or sliced | salt and freshly ground black pepper","Put the chorizo, onion and oil in a large, ovenproof frying pan over a low–medium heat and gently fry for about 10 minutes, until the chorizo is beginning to crisp and the onions are soft. | Add the peppers and fry for 5 minutes to soften, then stir in the garlic and fry for about 1 minute. | Stir in the tomatoes, tomato purée and sugar. Use 300ml/10fl oz water to swill out the tomato tins and stir this in too. Bring to a simmer, then stir in the gnocchi. Simmer for 8–10 minutes, stirring often, until the gnocchi are soft and the sauce has thickened. | Preheat the grill to medium–high. | Stir the kale into the pan with the gnocchi and season to taste. Scatter the mozzarella over the top and grill until the cheese is bubbling and golden.",https://www.bbc.co.uk/food/recipes/chorizo_gnocchi_48255,2026-07-14,chorizo | gnocchi,Spanish | gnocchi,Autumn | Winter,meat
"Creamy pasta with broccoli, peas and lemon",main,Serves 4,4,1,,30m,30m,,0.7933,"240g/8½oz whole wheat penne pasta | 200g/7oz long-stemmed broccoli, trimmed and each stalk cut into three pieces | 100g/3½oz frozen peas | 175g/7oz reduced-fat crème fraîche | 1 small lemon, finely grated zest only | 25g/1oz Parmesan, finely grated, plus extra for serving | salt and freshly ground black pepper","240g/8½oz whole wheat penne pasta | 200g/7oz long-stemmed broccoli, trimmed and each stalk cut into three pieces | 100g/3½oz frozen peas | 175g/7oz reduced-fat crème fraîche | 1 small lemon, finely grated zest only | 25g/1oz Parmesan, finely grated, plus extra for serving | salt and freshly ground black pepper","Half fill a large saucepan with water, add a large pinch of salt and bring to the boil. Add the pasta and cook for 10 minutes, stirring occasionally. | Stir in the broccoli and peas and boil for a further 2 minutes, then drain in a colander and return to the pan. | Add the crème fraîche, lemon zest and Parmesan and season generously with plenty of freshly ground black pepper and a little more salt. Toss together over a low heat for 20–30 seconds, or until the crème fraîche is hot, then serve sprinkled with a little extra cheese, if you like.",https://www.bbc.co.uk/food/recipes/penne_with_peas_and_44307,2026-07-14,pasta | broccoli,Italian | pasta,Autumn | Winter,vegetarian
Air fryer sticky chicken drumsticks,main,Serves 4,4,1,,30m,30m,,0.7989,2 tbsp light soy sauce | 3 tbsp tomato chutney (or any type will work) | 2 tbsp runny honey | 1 tsp Worcestershire sauce | 8 chicken drumsticks (see the recipe tip if you'd prefer to use thighs or legs) | potato salad and green crunchy leaves,2 tbsp light soy sauce | 3 tbsp tomato chutney (or any type will work) | 2 tbsp runny honey | 1 tsp Worcestershire sauce | 8 chicken drumsticks (see the recipe tip if you'd prefer to use thighs or legs) | potato salad and green crunchy leaves,"In a large bowl, mix together the marinade ingredients, then add the chicken and coat well with the marinade. Cover and keep in the fridge for anything from 20 minutes up to 24 hours. | When ready to cook, preheat the air fryer to 180C. | Lay the drumsticks in a single layer in the basket and cook for 10 minutes, then turn over and cook for another 10–12 minutes until they are crispy and charred. | Serve hot or cold with a potato salad and green crunchy leaves.",https://www.bbc.co.uk/food/recipes/air_fryer_chicken_27325,2026-07-14,chicken | honey,British | bake,Autumn | Winter,meat
Peri-peri chicken,main,Serves 4,4,1,,30m,30m,,0.5669,"8 skinless and boneless chicken thigh fillets | 75ml/2½fl oz medium–hot peri peri sauce | ½ tsp hot smoked paprika | sea salt and freshly ground black pepper | 1 tsp olive oil | 1 red onion, finely chopped | 1 red pepper, halved, cored, seeds removed and finely chopped | 1 green pepper, halved, cored, seeds removed and finely chopped | 2 garlic cloves, finely chopped | 1 tsp paprika | 1 tsp ground cumin | large pinch saffron strands | 200ml/7fl oz chicken stock | 1 chicken stock cube, crumbled | 500g/1lb 2oz cooked brown rice (freshly cooked and drained or 2 pouches) | 250g/9oz red and/or white cabbage, finely shredded | 1 carrot, grated (about 100g/3½oz prepared weight) | 2 tbsp fat-free Greek-style yoghurt | 2 tbsp white wine vinegar | 3 tbsp light mayonnaise | salt and freshly ground black pepper","8 skinless and boneless chicken thigh fillets | 75ml/2½fl oz medium–hot peri peri sauce | ½ tsp hot smoked paprika | sea salt and freshly ground black pepper | 1 tsp olive oil | 1 red onion, finely chopped | 1 red pepper, halved, cored, seeds removed and finely chopped | 1 green pepper, halved, cored, seeds removed and finely chopped | 2 garlic cloves, finely chopped | 1 tsp paprika | 1 tsp ground cumin | large pinch saffron strands | 200ml/7fl oz chicken stock | 1 chicken stock cube, crumbled | 500g/1lb 2oz cooked brown rice (freshly cooked and drained or 2 pouches) | 250g/9oz red and/or white cabbage, finely shredded | 1 carrot, grated (about 100g/3½oz prepared weight) | 2 tbsp fat-free Greek-style yoghurt | 2 tbsp white wine vinegar | 3 tbsp light mayonnaise | salt and freshly ground black pepper","Preheat the oven to 240C/220C Fan/Gas 9. Line a baking tray with an ovenproof silicone mat or baking paper. | Slash the chicken thighs with a sharp knife and put in a bowl. Add 50ml/2fl oz of the peri-peri sauce, the smoked paprika and a little sea salt and pepper. Turn the chicken to coat well in the sauce then lay on the baking tray and cook for 20–25 minutes. | Meanwhile, to make the dirty rice, heat the oil in a deep frying pan over a high heat. Add the onion and cook for 4–5 minutes until starting to brown. Add the peppers and garlic and cook for 2 minutes. Add the paprika and cumin and cook for 1 minute. | Grind the saffron with a pestle and mortar and add to the pan with the stock and stock cube. Simmer for 2–3 minutes, stirring, until the stock cube has disolved. Add the rice and warm through for 5 minutes. | To make the coleslaw, mix all the ingredients together in a bowl and season with salt and pepper. | Remove the chicken from the oven, tip the juices from the tray into the rice and stir through. Cook the rice for a further 2 minutes. | If you would like an extra charred flavour, wave a cook’s blowtorch over the surface of the chicken thighs to lightly char, then brush with the remaining peri-peri sauce. This step is optional, but it does give the chicken a flavour boost! | Serve the chicken with the rice and coleslaw on the side.",https://www.bbc.co.uk/food/recipes/peri-peri_chicken_79598,2026-07-14,chicken | rice,African | peri-peri,Autumn | Winter,meat
Easy chicken tikka masala,main,Serves 4,4,1,,30m,30m,,0.6656,"4 chicken breasts, skinned, boned and cubed | 2.5cm/1in piece of fresh root ginger, finely chopped | 2 garlic cloves, finely chopped | 1 tsp chilli powder | sea salt and freshly ground black pepper | 2 tbsp chopped fresh coriander, plus extra to garnish | 1 lime, juice only | 2 tbsp vegetable oil | 1 onion, finely chopped | 1 red chilli, seeds removed and finely chopped | 1 tsp ground turmeric | 200ml/7fl oz double cream | ½ lemon | basmati rice, cooked according to packet instructions | naan bread","4 chicken breasts, skinned, boned and cubed | 2.5cm/1in piece of fresh root ginger, finely chopped | 2 garlic cloves, finely chopped | 1 tsp chilli powder | sea salt and freshly ground black pepper | 2 tbsp chopped fresh coriander, plus extra to garnish | 1 lime, juice only | 2 tbsp vegetable oil | 1 onion, finely chopped | 1 red chilli, seeds removed and finely chopped | 1 tsp ground turmeric | 200ml/7fl oz double cream | ½ lemon | basmati rice, cooked according to packet instructions | naan bread","Put the chicken breasts in a large bowl and mix with the ginger, garlic, chilli, salt, pepper, coriander, lime juice and 1 tablespoon of the oil. Set aside for at least 5 minutes to allow the flavours to develop. | Heat a heavy-bottomed shallow pan and, when hot, add the chicken. Cook for 8-10 minutes until the chicken is browned on all sides. | Meanwhile, heat the remaining oil in a large pan and cook the onion and red chilli for 5-6 minutes until golden brown. Add the turmeric and cook for 1 minute. Stir in the cream and cook gently for a couple of minutes. | Add the chicken to the creamy sauce and simmer for 5 minutes, or until the chicken is cooked through. Check for seasoning, and add lemon juice to taste. | Garnish with fresh coriander and serve immediately with rice or naan bread.",https://www.bbc.co.uk/food/recipes/chickentikkamasala_73305,2026-07-14,chicken | rice,British | curry,Autumn | Winter,meat
Chicken satay noodles,main,Serves 4,4,1,,30m,30m,,0.6503,"400g/14oz chicken or turkey breast, cut into strips | 2 tbsp soy sauce | 1 tsp cornflour | 375g/13oz dried egg noodles | 2 tsp rapeseed oil | 6 spring onions, thinly sliced | 3 tbsp peanut butter | 2 tbsp sweet chilli sauce | 1 x 400ml tin reduced-fat coconut milk | 100g/3½oz sugar snap peas | 150g/5½oz mixed frozen beans and peas | 100g/3½oz frozen sweetcorn | 1 lime, juice only | 1 carrot, shaved into thin slices using a vegetable peeler | 75g/2¾oz baby spinach leaves | 2 tbsp roughly chopped cashew nuts | 2 tbsp freshly chopped coriander","400g/14oz chicken or turkey breast, cut into strips | 2 tbsp soy sauce | 1 tsp cornflour | 375g/13oz dried egg noodles | 2 tsp rapeseed oil | 6 spring onions, thinly sliced | 3 tbsp peanut butter | 2 tbsp sweet chilli sauce | 1 x 400ml tin reduced-fat coconut milk | 100g/3½oz sugar snap peas | 150g/5½oz mixed frozen beans and peas | 100g/3½oz frozen sweetcorn | 1 lime, juice only | 1 carrot, shaved into thin slices using a vegetable peeler | 75g/2¾oz baby spinach leaves | 2 tbsp roughly chopped cashew nuts | 2 tbsp freshly chopped coriander","Put the chicken in a bowl, add the soy sauce and cornflour and mix well. Cover and set aside for a few moments. | Meanwhile, bring a large pan of water to the boil, add the noodles and cook according to the packet instructions. Drain in a colander, rinse with cold water until they are cold, then drain once more and tip them back into the cold pan. Add half the rapeseed oil and toss. | Heat a wok until hot, add the remaining rapeseed oil and the spring onions and stir-fry for 1 minute, or until softened. Add the peanut butter, chilli sauce and coconut milk and stir until combined. Bring to a simmer, then add the marinated chicken and poach for 4 minutes, or until cooked through. Add the sugar snap peas and simmer for another 2 minutes, or until nearly tender, then add the frozen peas, beans and sweetcorn. Return to the boil, stir in the lime juice and check the seasoning – you might want to add more lime juice or chilli, depending how hot you like it. | Stir in the cooked noodles and heat for 1-2 minutes, or until hot through. Stir in the carrot shavings and spinach and remove from the heat. The heat from the dish will wilt the spinach down. Stir a couple of times. | Serve in bowls, garnished with the cashews and coriander.",https://www.bbc.co.uk/food/recipes/chicken_satay_noodles_95490,2026-07-14,chicken | noodles,Thai | satay,All,meat
